--
-- Statement level tracking
--
CREATE EXTENSION pg_stat_monitor;
SET pg_stat_monitor.pgsm_track_utility = on;
SET pg_stat_monitor.pgsm_normalized_query = on;
SELECT pg_stat_monitor_reset();
 pg_stat_monitor_reset 
-----------------------
 
(1 row)

-- DO block - top-level tracking.
CREATE TABLE stats_track_tab (x int);
SET pg_stat_monitor.pgsm_track = 'top';
DELETE FROM stats_track_tab;
DO $$
BEGIN
    DELETE FROM stats_track_tab;
END
$$;
SELECT toplevel, calls, query FROM pg_stat_monitor
    WHERE query LIKE '%DELETE%' ORDER BY query COLLATE "C", toplevel;
 toplevel | calls |              query               
----------+-------+----------------------------------
 t        |     1 | DELETE FROM stats_track_tab
 t        |     1 | DO $$                           +
          |       | BEGIN                           +
          |       |     DELETE FROM stats_track_tab;+
          |       | END                             +
          |       | $$
(2 rows)

SELECT pg_stat_monitor_reset();
 pg_stat_monitor_reset 
-----------------------
 
(1 row)

-- DO block - all-level tracking.
SET pg_stat_monitor.pgsm_track = 'all';
DELETE FROM stats_track_tab;
DO $$
BEGIN
    DELETE FROM stats_track_tab;
END
$$;
DO $$
BEGIN
    -- this is a SELECT
    PERFORM 'hello world'::text;
END
$$;
SELECT toplevel, calls, query FROM pg_stat_monitor
    ORDER BY query COLLATE "C", toplevel;
 toplevel | calls |                 query                  
----------+-------+----------------------------------------
 f        |     1 | DELETE FROM stats_track_tab
 t        |     1 | DELETE FROM stats_track_tab
 t        |     1 | DO $$                                 +
          |       | BEGIN                                 +
          |       |     -- this is a SELECT               +
          |       |     PERFORM 'hello world'::text;      +
          |       | END                                   +
          |       | $$
 t        |     1 | DO $$                                 +
          |       | BEGIN                                 +
          |       |     DELETE FROM stats_track_tab;      +
          |       | END                                   +
          |       | $$
 f        |     1 | SELECT $1::text
 t        |     1 | SELECT pg_stat_monitor_reset()
 t        |     1 | SET pg_stat_monitor.pgsm_track = 'all'
(7 rows)

-- DO block - top-level tracking without utility.
SET pg_stat_monitor.pgsm_track = 'top';
SET pg_stat_monitor.pgsm_track_utility = off;
SELECT pg_stat_monitor_reset();
 pg_stat_monitor_reset 
-----------------------
 
(1 row)

DELETE FROM stats_track_tab;
DO $$
BEGIN
    DELETE FROM stats_track_tab;
END
$$;
DO $$
BEGIN
    -- this is a SELECT
    PERFORM 'hello world'::text;
END
$$;
SELECT toplevel, calls, query FROM pg_stat_monitor
    ORDER BY query COLLATE "C", toplevel;
 toplevel | calls |             query              
----------+-------+--------------------------------
 t        |     1 | DELETE FROM stats_track_tab
 t        |     1 | SELECT pg_stat_monitor_reset()
(2 rows)

-- DO block - all-level tracking without utility.
SET pg_stat_monitor.pgsm_track = 'all';
SELECT pg_stat_monitor_reset();
 pg_stat_monitor_reset 
-----------------------
 
(1 row)

DELETE FROM stats_track_tab;
DO $$
BEGIN
    DELETE FROM stats_track_tab;
END
$$;
DO $$
BEGIN
    -- this is a SELECT
    PERFORM 'hello world'::text;
END
$$;
SELECT toplevel, calls, query FROM pg_stat_monitor
    ORDER BY query COLLATE "C", toplevel;
 toplevel | calls |             query              
----------+-------+--------------------------------
 f        |     1 | DELETE FROM stats_track_tab
 t        |     1 | DELETE FROM stats_track_tab
 f        |     1 | SELECT $1::text
 t        |     1 | SELECT pg_stat_monitor_reset()
(4 rows)

-- PL/pgSQL function - top-level tracking.
SET pg_stat_monitor.pgsm_track = 'top';
SET pg_stat_monitor.pgsm_track_utility = off;
SELECT pg_stat_monitor_reset();
 pg_stat_monitor_reset 
-----------------------
 
(1 row)

CREATE FUNCTION plus_two(i int) RETURNS int AS $$
DECLARE
    r int;
BEGIN
    SELECT (i + 1 + 1.0)::int INTO r;
    RETURN r;
END
$$ LANGUAGE plpgsql;
SELECT plus_two(3);
 plus_two 
----------
        5
(1 row)

SELECT plus_two(7);
 plus_two 
----------
        9
(1 row)

-- SQL function --- use LIMIT to keep it from being inlined
CREATE FUNCTION plus_one(i int) RETURNS int AS
$$ SELECT (i + 1.0)::int LIMIT 1 $$ LANGUAGE sql;
SELECT plus_one(8);
 plus_one 
----------
        9
(1 row)

SELECT plus_one(10);
 plus_one 
----------
       11
(1 row)

SELECT calls, rows, query FROM pg_stat_monitor ORDER BY query COLLATE "C";
 calls | rows |             query              
-------+------+--------------------------------
     1 |    1 | SELECT pg_stat_monitor_reset()
     2 |    2 | SELECT plus_one($1)
     2 |    2 | SELECT plus_two($1)
(3 rows)

-- immutable SQL function --- can be executed at plan time
CREATE FUNCTION plus_three(i int) RETURNS int AS
$$ SELECT i + 3 LIMIT 1 $$ IMMUTABLE LANGUAGE sql;
SELECT plus_three(8);
 plus_three 
------------
         11
(1 row)

SELECT plus_three(10);
 plus_three 
------------
         13
(1 row)

SELECT toplevel, calls, rows, query FROM pg_stat_monitor ORDER BY query COLLATE "C";
 toplevel | calls | rows |                                   query                                   
----------+-------+------+---------------------------------------------------------------------------
 t        |     1 |    3 | SELECT calls, rows, query FROM pg_stat_monitor ORDER BY query COLLATE "C"
 t        |     1 |    1 | SELECT pg_stat_monitor_reset()
 t        |     2 |    2 | SELECT plus_one($1)
 t        |     2 |    2 | SELECT plus_three($1)
 t        |     2 |    2 | SELECT plus_two($1)
(5 rows)

-- PL/pgSQL function - all-level tracking.
SET pg_stat_monitor.pgsm_track = 'all';
SELECT pg_stat_monitor_reset();
 pg_stat_monitor_reset 
-----------------------
 
(1 row)

-- we drop and recreate the functions to avoid any caching funnies
DROP FUNCTION plus_one(int);
DROP FUNCTION plus_two(int);
DROP FUNCTION plus_three(int);
-- PL/pgSQL function
CREATE FUNCTION plus_two(i int) RETURNS int AS $$
DECLARE
    r int;
BEGIN
    SELECT (i + 1 + 1.0)::int INTO r;
    RETURN r;
END
$$ LANGUAGE plpgsql;
SELECT plus_two(-1);
 plus_two 
----------
        1
(1 row)

SELECT plus_two(2);
 plus_two 
----------
        4
(1 row)

-- SQL function --- use LIMIT to keep it from being inlined
CREATE FUNCTION plus_one(i int) RETURNS int AS
$$ SELECT (i + 1.0)::int LIMIT 1 $$ LANGUAGE sql;
SELECT plus_one(3);
 plus_one 
----------
        4
(1 row)

SELECT plus_one(1);
 plus_one 
----------
        2
(1 row)

SELECT calls, rows, query FROM pg_stat_monitor ORDER BY query COLLATE "C";
 calls | rows |             query              
-------+------+--------------------------------
     2 |    2 | SELECT (i + $2 + $3)::int
     2 |    2 | SELECT (i + $2)::int LIMIT $3
     1 |    1 | SELECT pg_stat_monitor_reset()
     2 |    2 | SELECT plus_one($1)
     2 |    2 | SELECT plus_two($1)
(5 rows)

-- immutable SQL function --- can be executed at plan time
CREATE FUNCTION plus_three(i int) RETURNS int AS
$$ SELECT i + 3 LIMIT 1 $$ IMMUTABLE LANGUAGE sql;
SELECT plus_three(8);
 plus_three 
------------
         11
(1 row)

SELECT plus_three(10);
 plus_three 
------------
         13
(1 row)

SELECT toplevel, calls, rows, query FROM pg_stat_monitor ORDER BY query COLLATE "C";
 toplevel | calls | rows |                                   query                                   
----------+-------+------+---------------------------------------------------------------------------
 f        |     2 |    2 | SELECT (i + $2 + $3)::int
 f        |     2 |    2 | SELECT (i + $2)::int LIMIT $3
 t        |     1 |    5 | SELECT calls, rows, query FROM pg_stat_monitor ORDER BY query COLLATE "C"
 f        |     2 |    2 | SELECT i + $2 LIMIT $3
 t        |     1 |    1 | SELECT pg_stat_monitor_reset()
 t        |     2 |    2 | SELECT plus_one($1)
 t        |     2 |    2 | SELECT plus_three($1)
 t        |     2 |    2 | SELECT plus_two($1)
(8 rows)

--
-- pg_stat_monitor.pgsm_track = none
--
SET pg_stat_monitor.pgsm_track = 'none';
SELECT pg_stat_monitor_reset();
 pg_stat_monitor_reset 
-----------------------
 
(1 row)

SELECT 1 AS one;
 one 
-----
   1
(1 row)

SELECT 1 + 1 AS two;
 two 
-----
   2
(1 row)

SELECT calls, rows, query FROM pg_stat_monitor ORDER BY query COLLATE "C";
 calls | rows | query 
-------+------+-------
(0 rows)

SELECT pg_stat_monitor_reset();
 pg_stat_monitor_reset 
-----------------------
 
(1 row)

DROP EXTENSION pg_stat_monitor;
